[
  {
    "actor_id": "human",
    "actor_type": "human",
    "event_hash": "ed0aedc40ca79b63b388451fc71b1460d3c1d48b5f3e3a10f6bdb63ad1ab20a9",
    "event_id": "intent-created",
    "event_type": "intent.draft.created",
    "payload": {
      "intent": {
        "acceptance_summary": "feature value is 42",
        "constraints": [],
        "created_at": "2026-09-21T04:00:00Z",
        "created_by": "human",
        "intent_id": "I-001",
        "project_id": "prime-demo-clean",
        "purpose": "controlled Prime proof",
        "requirements": [
          {
            "requirement_id": "REQ-001",
            "text": "Create src/feature.py exposing VALUE = 42."
          }
        ],
        "schema_version": 1,
        "source_event_id": "intent-created",
        "status": "DRAFT",
        "title": "Expose feature value",
        "version": 1
      }
    },
    "previous_event_hash": null,
    "previous_event_id": null,
    "project_id": "prime-demo-clean",
    "schema_version": 1,
    "timestamp": "2026-09-21T04:00:00Z"
  },
  {
    "actor_id": "human",
    "actor_type": "human",
    "event_hash": "218e7ef9d7d00003881bc01fc46089913ad7ab0ba1010db9cc4eb5b8dbcc6d8a",
    "event_id": "intent-approved",
    "event_type": "intent.approved",
    "payload": {
      "intent": {
        "acceptance_summary": "feature value is 42",
        "approval_event_id": "intent-approved",
        "approved_at": "2026-09-21T04:00:00Z",
        "approved_by": "human",
        "constraints": [],
        "created_at": "2026-09-21T04:00:00Z",
        "created_by": "human",
        "intent_id": "I-001",
        "project_id": "prime-demo-clean",
        "purpose": "controlled Prime proof",
        "requirements": [
          {
            "requirement_id": "REQ-001",
            "text": "Create src/feature.py exposing VALUE = 42."
          }
        ],
        "schema_version": 1,
        "source_event_id": "intent-created",
        "status": "APPROVED",
        "title": "Expose feature value",
        "version": 1
      }
    },
    "previous_event_hash": "ed0aedc40ca79b63b388451fc71b1460d3c1d48b5f3e3a10f6bdb63ad1ab20a9",
    "previous_event_id": "intent-created",
    "project_id": "prime-demo-clean",
    "schema_version": 1,
    "timestamp": "2026-09-21T04:00:00Z"
  },
  {
    "actor_id": "planner",
    "actor_type": "agent",
    "event_hash": "52592198a17477664baa43d70b306befb1c87a59d9515b1b3651f7502f649119",
    "event_id": "graph-created",
    "event_type": "graph.created",
    "payload": {
      "graph": {
        "created_at": "2026-09-21T04:00:00Z",
        "created_by": "planner",
        "edges": [],
        "graph_id": "G-001",
        "intent_id": "I-001",
        "intent_version": 1,
        "nodes": [
          {
            "eu_id": "EU-001",
            "requirement_ids": [
              "REQ-001"
            ]
          }
        ],
        "project_id": "prime-demo-clean",
        "reason": "one vertical EU",
        "schema_version": 1,
        "source_event_id": "graph-created",
        "status": "ACTIVE",
        "version": 1
      }
    },
    "previous_event_hash": "218e7ef9d7d00003881bc01fc46089913ad7ab0ba1010db9cc4eb5b8dbcc6d8a",
    "previous_event_id": "intent-approved",
    "project_id": "prime-demo-clean",
    "schema_version": 1,
    "timestamp": "2026-09-21T04:00:00Z"
  },
  {
    "actor_id": "controller",
    "actor_type": "controller",
    "event_hash": "1c185004a721ed802418fcd645833d33a17f815ab9ff02f7b94bed694b11916b",
    "event_id": "prime-proposed",
    "event_type": "plan.proposed",
    "execution_id": "EXEC-CONTROLLER-CLEAN",
    "payload": {
      "operation": {
        "branch": null,
        "candidate_sha": null,
        "created_at": "2026-09-21T04:00:00Z",
        "eu_paths": {
          "EU-001": [
            "src/feature.py"
          ]
        },
        "execution_id": "EXEC-CONTROLLER-CLEAN",
        "gate_id": null,
        "graph_id": "G-001",
        "graph_version": 1,
        "intent_id": "I-001",
        "intent_version": 1,
        "operation_id": "OP-PRIME-CLEAN",
        "project_id": "prime-demo-clean",
        "schema_version": 1,
        "status": "PLANNER_PROPOSED",
        "worktree": null
      }
    },
    "previous_event_hash": "52592198a17477664baa43d70b306befb1c87a59d9515b1b3651f7502f649119",
    "previous_event_id": "graph-created",
    "project_id": "prime-demo-clean",
    "schema_version": 1,
    "timestamp": "2026-09-21T04:00:00Z"
  },
  {
    "actor_id": "controller",
    "actor_type": "human",
    "event_hash": "b614f1f64b506867faa6f44ebdc18710f8f1e503f5680abf57c4f47b86b8bf05",
    "event_id": "prime-graph-evaluator-cap",
    "event_type": "capability.issued",
    "execution_id": "EXEC-GRAPH-EVALUATOR-000101",
    "payload": {
      "capability": {
        "allowed_executes": [],
        "allowed_operations": [
          "READ",
          "CREATE_ARTIFACT"
        ],
        "allowed_reads": [
          ".idd/intent/I-001/v1.json",
          ".idd/graph/G-001/v1.json"
        ],
        "allowed_request_types": [],
        "allowed_writes": [],
        "baseline_sha": "3a9595e479bd0291735611223ad103d939b68d50",
        "capability_id": "CAP-101",
        "execution_id": "EXEC-GRAPH-EVALUATOR-000101",
        "forbidden_operations": [
          "WRITE",
          "PROMOTE",
          "HUMAN_GATE_APPROVAL"
        ],
        "integrity_hash": "6a6014179f34375392e4b6ff503981ae276cf723b90572de6740b23ddc0ebdb1",
        "issued_at": "2026-09-21T04:00:00Z",
        "issued_by": "controller",
        "project_id": "prime-demo-clean",
        "role": "GRAPH_EVALUATOR",
        "schema_version": 1,
        "scope_bindings": {
          "eu_id": "GRAPH",
          "graph_id": "G-001",
          "graph_version": 1,
          "intent_id": "I-001",
          "intent_version": 1
        },
        "version": 1
      }
    },
    "previous_event_hash": "1c185004a721ed802418fcd645833d33a17f815ab9ff02f7b94bed694b11916b",
    "previous_event_id": "prime-proposed",
    "project_id": "prime-demo-clean",
    "schema_version": 1,
    "timestamp": "2026-09-21T04:00:00Z"
  },
  {
    "actor_id": "context-compiler",
    "actor_type": "controller",
    "event_hash": "bdfea6bee93319830947bfb4dd568b8f5fc392866e77353ee3bdc69bb1013584",
    "event_id": "prime-graph-evaluator-packet",
    "event_type": "context.packet.created",
    "execution_id": "EXEC-GRAPH-EVALUATOR-000101",
    "payload": {
      "packet": {
        "authority_context": {
          "acceptance_requirements": [
            "valid graph bindings"
          ],
          "allowed_operations": [
            "READ",
            "CREATE_ARTIFACT"
          ]
        },
        "baseline_sha": "3a9595e479bd0291735611223ad103d939b68d50",
        "capability_id": "CAP-101",
        "context_budget": {
          "max_bytes": 100000
        },
        "context_packet_id": "CP-101",
        "created_at": "2026-09-21T04:00:00Z",
        "eu_binding": {
          "eu_id": "GRAPH"
        },
        "evidence_context": [],
        "execution_id": "EXEC-GRAPH-EVALUATOR-000101",
        "graph_binding": {
          "graph_id": "G-001",
          "graph_version": 1
        },
        "intent_binding": {
          "intent_id": "I-001",
          "intent_version": 1
        },
        "knowledge_context": [],
        "packet_hash": "058bd0785f382583e2906b69bd03e5b7534400b036f74d8c7fdb819f65435b54",
        "project_id": "prime-demo-clean",
        "role": "GRAPH_EVALUATOR",
        "schema_version": 1,
        "version": 1,
        "working_context": []
      },
      "packet_bytes": 733,
      "resource_count": 0
    },
    "previous_event_hash": "b614f1f64b506867faa6f44ebdc18710f8f1e503f5680abf57c4f47b86b8bf05",
    "previous_event_id": "prime-graph-evaluator-cap",
    "project_id": "prime-demo-clean",
    "schema_version": 1,
    "timestamp": "2026-09-21T04:00:00Z"
  },
  {
    "actor_id": "controller",
    "actor_type": "controller",
    "event_hash": "e1cc74356b02af9e7d282e1818f512dc0c5130a222ba9b93e315c79ae229293d",
    "event_id": "prime-graph-evaluated",
    "event_type": "graph.evaluated",
    "execution_id": "EXEC-CONTROLLER-CLEAN",
    "payload": {
      "operation": {
        "branch": null,
        "candidate_sha": null,
        "created_at": "2026-09-21T04:00:00Z",
        "eu_paths": {
          "EU-001": [
            "src/feature.py"
          ]
        },
        "execution_id": "EXEC-CONTROLLER-CLEAN",
        "gate_id": null,
        "graph_evaluator_capability_id": "CAP-101",
        "graph_evaluator_context_packet_hash": "058bd0785f382583e2906b69bd03e5b7534400b036f74d8c7fdb819f65435b54",
        "graph_evaluator_context_packet_id": "CP-101",
        "graph_evaluator_execution_id": "EXEC-GRAPH-EVALUATOR-000101",
        "graph_evaluator_result": "PASS",
        "graph_id": "G-001",
        "graph_version": 1,
        "intent_id": "I-001",
        "intent_version": 1,
        "operation_id": "OP-PRIME-CLEAN",
        "planner_execution_id": "EXEC-PLANNER-000001",
        "project_id": "prime-demo-clean",
        "schema_version": 1,
        "status": "ACTIVE",
        "worktree": null
      }
    },
    "previous_event_hash": "bdfea6bee93319830947bfb4dd568b8f5fc392866e77353ee3bdc69bb1013584",
    "previous_event_id": "prime-graph-evaluator-packet",
    "project_id": "prime-demo-clean",
    "schema_version": 1,
    "timestamp": "2026-09-21T04:00:00Z"
  },
  {
    "actor_id": "controller",
    "actor_type": "human",
    "event_hash": "101c6248b13875feae560cd7907a2c5b7a7d4514a8ac85e985428b7f6535a5a1",
    "event_id": "prime-cap",
    "event_type": "capability.issued",
    "execution_id": "EXEC-BUILDER-000011",
    "payload": {
      "capability": {
        "allowed_executes": [
          "git",
          "python3"
        ],
        "allowed_operations": [
          "READ",
          "WRITE",
          "EXECUTE",
          "CREATE_ARTIFACT"
        ],
        "allowed_reads": [
          "src/feature.py"
        ],